{
  "schema_version": "modifier-v1",
  "decision_stage": "reward",
  "state": {
    "run": {
      "wave_index": 5,
      "money": 0,
      "reroll_cost": 250,
      "reroll_count": 0,
      "lock_rarities": 0,
      "shop_available": 1,
      "purchases_this_phase": 0,
      "waves_until_next_fixed_battle": 3,
      "waves_until_next_boss": 5,
      "party_luck": 0,
      "goal_profile": {
        "w_run": 1,
        "w_meta": 0
      }
    },
    "party_slots": [
      {
        "present": 1,
        "fainted": 0,
        "hp_ratio": 1,
        "level": 5,
        "level_ratio_to_cap": 0.5,
        "status": 0,
        "types": [
          11,
          3
        ],
        "base_stat_total": 318,
        "move_count": 3,
        "min_pp_ratio": 0.8571428571428571,
        "held_items": [
          {
            "item_id": "BERRY",
            "item_family": "berry",
            "variant": {
              "berry_type": 0
            },
            "tier": 0,
            "stacks": 2,
            "max_stacks": 2
          }
        ]
      },
      {
        "present": 1,
        "fainted": 0,
        "hp_ratio": 0.47368421052631576,
        "level": 5,
        "level_ratio_to_cap": 0.5,
        "status": 0,
        "types": [
          9
        ],
        "base_stat_total": 309,
        "move_count": 3,
        "min_pp_ratio": 1,
        "held_items": []
      },
      {
        "present": 1,
        "fainted": 1,
        "hp_ratio": 0,
        "level": 5,
        "level_ratio_to_cap": 0.5,
        "status": 0,
        "types": [
          10
        ],
        "base_stat_total": 314,
        "move_count": 3,
        "min_pp_ratio": 1,
        "held_items": []
      },
      {
        "present": 0,
        "fainted": 0,
        "hp_ratio": 0,
        "level": 0,
        "level_ratio_to_cap": 0,
        "status": 0,
        "types": [],
        "base_stat_total": 0,
        "move_count": 0,
        "min_pp_ratio": 0,
        "held_items": []
      },
      {
        "present": 0,
        "fainted": 0,
        "hp_ratio": 0,
        "level": 0,
        "level_ratio_to_cap": 0,
        "status": 0,
        "types": [],
        "base_stat_total": 0,
        "move_count": 0,
        "min_pp_ratio": 0,
        "held_items": []
      },
      {
        "present": 0,
        "fainted": 0,
        "hp_ratio": 0,
        "level": 0,
        "level_ratio_to_cap": 0,
        "status": 0,
        "types": [],
        "base_stat_total": 0,
        "move_count": 0,
        "min_pp_ratio": 0,
        "held_items": []
      }
    ],
    "global_items": [
      {
        "item_id": "CANDY_JAR",
        "item_family": "level_booster",
        "variant": {},
        "tier": 2,
        "stacks": 2,
        "max_stacks": 99
      },
      {
        "item_id": "TEMP_STAT_STAGE_BOOSTER",
        "item_family": "temp_battle_booster",
        "variant": {
          "stat": 1
        },
        "tier": 0,
        "stacks": 1,
        "max_stacks": 2,
        "max_battles": 5,
        "battles_remaining": 5
      },
      {
        "item_id": "LURE",
        "item_family": "lure",
        "variant": {},
        "tier": 0,
        "stacks": 1,
        "max_stacks": 2,
        "max_battles": 10,
        "battles_remaining": 10
      }
    ],
    "inventory": {
      "pokeball_counts": [
        5,
        0,
        0,
        0,
        0
      ]
    },
    "offer": [
      {
        "source": "reward",
        "reward_index": 0,
        "item_id": "RARE_CANDY",
        "item_family": "level_up",
        "variant": {},
        "tier": 0,
        "upgrade_count": 0,
        "cost": 0
      },
      {
        "source": "reward",
        "reward_index": 1,
        "item_id": "BERRY",
        "item_family": "berry",
        "variant": {
          "berry_type": 0
        },
        "tier": 0,
        "upgrade_count": 0,
        "cost": 0
      },
      {
        "source": "reward",
        "reward_index": 2,
        "item_id": "POKEBALL",
        "item_family": "ball",
        "variant": {
          "pokeball_type": 0,
          "count": 5
        },
        "tier": 0,
        "upgrade_count": 0,
        "cost": 0
      },
      {
        "source": "reward",
        "reward_index": 3,
        "item_id": "ETHER",
        "item_family": "pp_restore",
        "variant": {},
        "tier": -1,
        "upgrade_count": 0,
        "cost": 0
      },
      {
        "source": "shop",
        "shop_row_index": 0,
        "shop_column_index": 0,
        "item_id": "PokemonHpRestoreModifierType",
        "item_family": "other",
        "variant": {},
        "tier": -1,
        "upgrade_count": 0,
        "cost": 44
      },
      {
        "source": "shop",
        "shop_row_index": 0,
        "shop_column_index": 1,
        "item_id": "PokemonPpRestoreModifierType",
        "item_family": "other",
        "variant": {},
        "tier": -1,
        "upgrade_count": 0,
        "cost": 88
      },
      {
        "source": "shop",
        "shop_row_index": 0,
        "shop_column_index": 2,
        "item_id": "PokemonReviveModifierType",
        "item_family": "other",
        "variant": {},
        "tier": -1,
        "upgrade_count": 0,
        "cost": 440
      }
    ]
  },
  "candidates": [
    {
      "kind": "take_reward",
      "mask": 1,
      "reward_index": 0,
      "item_id": "RARE_CANDY",
      "item_family": "level_up",
      "variant": {},
      "tier": 0,
      "upgrade_count": 0,
      "cost": 0,
      "target_party_index": 0,
      "owned_stacks": 0,
      "effect": {
        "level_gain": 3
      }
    },
    {
      "kind": "take_reward",
      "mask": 1,
      "reward_index": 0,
      "item_id": "RARE_CANDY",
      "item_family": "level_up",
      "variant": {},
      "tier": 0,
      "upgrade_count": 0,
      "cost": 0,
      "target_party_index": 1,
      "owned_stacks": 0,
      "effect": {
        "level_gain": 3
      }
    },
    {
      "kind": "take_reward",
      "mask": 1,
      "reward_index": 0,
      "item_id": "RARE_CANDY",
      "item_family": "level_up",
      "variant": {},
      "tier": 0,
      "upgrade_count": 0,
      "cost": 0,
      "target_party_index": 2,
      "owned_stacks": 0,
      "effect": {
        "level_gain": 3
      }
    },
    {
      "kind": "take_reward",
      "mask": 0,
      "reward_index": 1,
      "item_id": "BERRY",
      "item_family": "berry",
      "variant": {
        "berry_type": 0
      },
      "tier": 0,
      "upgrade_count": 0,
      "cost": 0,
      "target_party_index": 0,
      "owned_stacks": 2,
      "owned_max_stacks": 2,
      "mask_reason": "select_filter:Bulbasaur has too many of this item!"
    },
    {
      "kind": "take_reward",
      "mask": 1,
      "reward_index": 1,
      "item_id": "BERRY",
      "item_family": "berry",
      "variant": {
        "berry_type": 0
      },
      "tier": 0,
      "upgrade_count": 0,
      "cost": 0,
      "target_party_index": 1,
      "owned_stacks": 0
    },
    {
      "kind": "take_reward",
      "mask": 1,
      "reward_index": 1,
      "item_id": "BERRY",
      "item_family": "berry",
      "variant": {
        "berry_type": 0
      },
      "tier": 0,
      "upgrade_count": 0,
      "cost": 0,
      "target_party_index": 2,
      "owned_stacks": 0
    },
    {
      "kind": "take_reward",
      "mask": 1,
      "reward_index": 2,
      "item_id": "POKEBALL",
      "item_family": "ball",
      "variant": {
        "pokeball_type": 0,
        "count": 5
      },
      "tier": 0,
      "upgrade_count": 0,
      "cost": 0,
      "owned_stacks": 0
    },
    {
      "kind": "take_reward",
      "mask": 0,
      "reward_index": 3,
      "item_id": "ETHER",
      "item_family": "pp_restore",
      "variant": {},
      "tier": -1,
      "upgrade_count": 0,
      "cost": 0,
      "target_party_index": 0,
      "owned_stacks": 0,
      "target_move_index": 0,
      "mask_reason": "test_block"
    },
    {
      "kind": "take_reward",
      "mask": 0,
      "reward_index": 3,
      "item_id": "ETHER",
      "item_family": "pp_restore",
      "variant": {},
      "tier": -1,
      "upgrade_count": 0,
      "cost": 0,
      "target_party_index": 0,
      "owned_stacks": 0,
      "target_move_index": 1,
      "mask_reason": "move_select_filter:It won’t have any effect."
    },
    {
      "kind": "take_reward",
      "mask": 0,
      "reward_index": 3,
      "item_id": "ETHER",
      "item_family": "pp_restore",
      "variant": {},
      "tier": -1,
      "upgrade_count": 0,
      "cost": 0,
      "target_party_index": 0,
      "owned_stacks": 0,
      "target_move_index": 2,
      "mask_reason": "move_select_filter:It won’t have any effect."
    },
    {
      "kind": "take_reward",
      "mask": 0,
      "reward_index": 3,
      "item_id": "ETHER",
      "item_family": "pp_restore",
      "variant": {},
      "tier": -1,
      "upgrade_count": 0,
      "cost": 0,
      "target_party_index": 1,
      "owned_stacks": 0,
      "target_move_index": 0,
      "mask_reason": "move_select_filter:It won’t have any effect."
    },
    {
      "kind": "take_reward",
      "mask": 0,
      "reward_index": 3,
      "item_id": "ETHER",
      "item_family": "pp_restore",
      "variant": {},
      "tier": -1,
      "upgrade_count": 0,
      "cost": 0,
      "target_party_index": 1,
      "owned_stacks": 0,
      "target_move_index": 1,
      "mask_reason": "move_select_filter:It won’t have any effect."
    },
    {
      "kind": "take_reward",
      "mask": 0,
      "reward_index": 3,
      "item_id": "ETHER",
      "item_family": "pp_restore",
      "variant": {},
      "tier": -1,
      "upgrade_count": 0,
      "cost": 0,
      "target_party_index": 1,
      "owned_stacks": 0,
      "target_move_index": 2,
      "mask_reason": "move_select_filter:It won’t have any effect."
    },
    {
      "kind": "take_reward",
      "mask": 0,
      "reward_index": 3,
      "item_id": "ETHER",
      "item_family": "pp_restore",
      "variant": {},